{
  "version": 1,
  "owner": "dyrc9",
  "positioning": {
    "headline": "AI Agent / Harness Engineering",
    "summary": "Practical agent tooling focused on replayable workflows, inspectable artifacts, and operator-facing quality gates."
  },
  "workflow_pattern": [
    "source input",
    "staged processing",
    "inspectable artifact",
    "quality gate",
    "human or system decision"
  ],
  "active_products": [
    {
      "repo": "sushi-agent",
      "url": "https://github.com/dyrc9/sushi-agent",
      "category": "runtime",
      "status": "core-runtime-bet",
      "value": "TypeScript and Rust runtime for embedding providers, skills, MCP, and fast local tools into existing systems.",
      "surface": [
        "provider abstraction",
        "tool orchestration",
        "runtime embedding"
      ]
    },
    {
      "repo": "agent-meeting-notes",
      "url": "https://github.com/dyrc9/agent-meeting-notes",
      "category": "workflow-cli",
      "status": "working-cli-product",
      "value": "Long-audio transcription and meeting-notes harness with chunking, structured outputs, and exportable artifacts.",
      "surface": [
        "run",
        "probe",
        "estimate",
        "inspect",
        "check"
      ],
      "local_quickstart": [
        "agent-meeting-notes doctor",
        "agent-meeting-notes run path/to/meeting.mp3 --out runs/meeting-001 --transcriber openai --summarizer openai"
      ],
      "proof_commands": [
        "agent-meeting-notes doctor --json",
        "agent-meeting-notes probe meeting.mp3 --json",
        "agent-meeting-notes estimate meeting.mp3 --chunk-seconds 600",
        "agent-meeting-notes check examples/transcript.md"
      ],
      "artifact_examples": [
        "transcript.md with timestamps and speaker-attributed segments",
        "summary.md with decisions, action items, and risks",
        "notes.json with structured metadata for downstream review"
      ]
    },
    {
      "repo": "xhs-content-agent",
      "url": "https://github.com/dyrc9/xhs-content-agent",
      "category": "workflow-cli",
      "status": "working-cli-product",
      "value": "Human-reviewed content pipeline for Xiaohongshu and RedNote drafts, calendars, and publish packages.",
      "surface": [
        "draft",
        "calendar",
        "titles",
        "inspect",
        "check"
      ],
      "local_quickstart": [
        "xhs-content-agent doctor",
        "xhs-content-agent draft examples/idea.md --out runs/first-note"
      ],
      "proof_commands": [
        "xhs-content-agent doctor --json",
        "xhs-content-agent draft examples/idea.md --generator template --out runs/template-note",
        "xhs-content-agent inspect runs/template-note/note.json --json",
        "xhs-content-agent check runs/template-note/note.json --json --strict"
      ],
      "artifact_examples": [
        "note.json draft package with title, body, hashtags, and metadata",
        "calendar.csv or markdown planning output for reviewable scheduling",
        "diagnostic JSON from inspect and check commands for operator signoff"
      ],
      "safety_notes": [
        "no engagement manipulation",
        "no policy-evasion automation",
        "manual review before publishing"
      ]
    },
    {
      "repo": "dyrc9.github.io",
      "url": "https://github.com/dyrc9/dyrc9.github.io",
      "category": "public-surface",
      "status": "public-narrative-layer",
      "value": "Personal site and long-term public surface for demos, notes, and portfolio framing.",
      "surface": [
        "demos",
        "notes",
        "portfolio framing"
      ]
    }
  ],
  "shipped_workflow_slices": [
    {
      "product_repo": "agent-meeting-notes",
      "workflow": "Long meeting -> inspectable notes",
      "current_surface": "agent-meeting-notes run, probe, estimate, inspect, check",
      "why_it_matters": "Turns a multi-hour recording into reusable transcript and summary artifacts with preflight and quality gates."
    },
    {
      "product_repo": "xhs-content-agent",
      "workflow": "Raw idea -> publish package",
      "current_surface": "xhs-content-agent draft, calendar, titles, inspect, check",
      "why_it_matters": "Treats creator work as a reviewable pipeline instead of one-shot prompting or unsafe automation."
    },
    {
      "product_repo": "sushi-agent",
      "workflow": "Provider/tool runtime embedding",
      "current_surface": "sushi-agent runtime and local tools",
      "why_it_matters": "Pushes toward a reusable execution layer where models, tools, and traces can be composed inside real systems."
    }
  ],
  "supporting_repositories": [
    {
      "repo": "console-chat-gpt",
      "url": "https://github.com/dyrc9/console-chat-gpt",
      "why": "Early CLI experiments around chat APIs and terminal interaction patterns."
    },
    {
      "repo": "cwym",
      "url": "https://github.com/dyrc9/cwym",
      "why": "Networking and message-oriented systems practice."
    },
    {
      "repo": "CS353Project2",
      "url": "https://github.com/dyrc9/CS353Project2",
      "why": "Linux kernel lab work and low-level systems exposure."
    },
    {
      "repo": "Kitsune_prp",
      "url": "https://github.com/dyrc9/Kitsune_prp",
      "why": "Security and intrusion-detection related exploration."
    }
  ],
  "next_build_targets": [
    "compact agent harness lab with repeatable tasks and pass/fail checks",
    "stronger trace and evaluation surfaces around tool use",
    "more examples that show how CLI products fit into actual operator workflows"
  ]
}
